{
  "type": "economic_board",
  "name": "Gold Rush",
  "players": {
    "min": 2,
    "max": 4
  },
  "turn_based": true,
  "components": {
    "board": {
      "total_spaces": 20,
      "layout": "loop",
      "spaces": [
        {
          "index": 0,
          "type": "start",
          "name": "출발",
          "pass_go_bonus": 300
        },
        {
          "index": 1,
          "type": "property",
          "name": "금광 A",
          "group": "gold_mine",
          "price": 200,
          "rent": [20, 60, 180],
          "house_cost": 100
        },
        {
          "index": 2,
          "type": "property",
          "name": "금광 B",
          "group": "gold_mine",
          "price": 200,
          "rent": [20, 60, 180],
          "house_cost": 100
        },
        {
          "index": 3,
          "type": "event",
          "name": "이벤트 칸"
        },
        {
          "index": 4,
          "type": "property",
          "name": "은광 C",
          "group": "silver_mine",
          "price": 300,
          "rent": [30, 90, 270],
          "house_cost": 150
        },
        {
          "index": 5,
          "type": "property",
          "name": "은광 D",
          "group": "silver_mine",
          "price": 300,
          "rent": [30, 90, 270],
          "house_cost": 150
        },
        {
          "index": 6,
          "type": "tax",
          "name": "세금 칸",
          "price": 150
        },
        {
          "index": 7,
          "type": "property",
          "name": "다이아 광산 E",
          "group": "diamond_mine",
          "price": 400,
          "rent": [40, 120, 360],
          "house_cost": 200
        },
        {
          "index": 8,
          "type": "property",
          "name": "다이아 광산 F",
          "group": "diamond_mine",
          "price": 400,
          "rent": [40, 120, 360],
          "house_cost": 200
        },
        {
          "index": 9,
          "type": "special",
          "name": "휴식 칸"
        },
        {
          "index": 10,
          "type": "property",
          "name": "금광 G",
          "group": "gold_mine",
          "price": 250,
          "rent": [25, 75, 225],
          "house_cost": 100
        },
        {
          "index": 11,
          "type": "event",
          "name": "이벤트 칸"
        },
        {
          "index": 12,
          "type": "property",
          "name": "은광 H",
          "group": "silver_mine",
          "price": 350,
          "rent": [35, 105, 315],
          "house_cost": 150
        },
        {
          "index": 13,
          "type": "jail",
          "name": "감옥",
          "visit_only": true
        },
        {
          "index": 14,
          "type": "property",
          "name": "다이아 광산 I",
          "group": "diamond_mine",
          "price": 500,
          "rent": [50, 150, 450],
          "house_cost": 200
        },
        {
          "index": 15,
          "type": "tax",
          "name": "세금 칸",
          "price": 200
        },
        {
          "index": 16,
          "type": "property",
          "name": "금광 J",
          "group": "gold_mine",
          "price": 280,
          "rent": [28, 84, 252],
          "house_cost": 100
        },
        {
          "index": 17,
          "type": "property",
          "name": "은광 K",
          "group": "silver_mine",
          "price": 320,
          "rent": [32, 96, 288],
          "house_cost": 150
        },
        {
          "index": 18,
          "type": "property",
          "name": "다이아 광산 L",
          "group": "diamond_mine",
          "price": 600,
          "rent": [60, 180, 540],
          "house_cost": 200
        },
        {
          "index": 19,
          "type": "go_to_jail",
          "name": "감옥행"
        }
      ]
    },
    "dice": {
      "count": 2,
      "sides": 6
    },
    "starting_money": 1000,
    "currency_unit": "골드",
    "buildings": {
      "house_max": 2,
      "requires_complete_set": true
    }
  },
  "phases": ["roll_dice", "move", "action", "end_turn"],
  "win_condition": "last_player_standing",
  "special_rules": [
    {
      "name": "Building Requirement",
      "description": "To build, player must own all properties in the group.",
      "effect": "requirement"
    }
  ]
}
